# Community Call - Solutions

[![Ansible Lint](https://github.com/TimGrt/community-call-solutions/actions/workflows/ci.yml/badge.svg)](https://github.com/TimGrt/community-call-solutions/actions/workflows/ci.yml)

This repository contains the **sample solutions** for different exercises and demo content of the Ansible Community Call Sessions.

Clone this repository via HTTPS:

```bash
git clone https://github.com/TimGrt/community-call-solutions.git
```

To do the different exercises, observe the `README.md` files in the respective exercise or demo folders:

* [13.05.2025 - Demo - Roles from Galaxy collections](2025-05-13-demo-galaxy-collections/README.md)
* [08.04.2025 - Exercise - Ansible Navigator](2025-04-08-exercise-ansible-navigator/README.md)
* [11.03.2025 - Demo - Logging Ansible Content](2025-03-11-demo-logging-ansible-content/README.md)
* [11.02.2025 - Demo - Input Validation](2025-02-11-demo-input-validation/README.md)
* [08.11.2024 - Demo - Policy as Code](2024-11-08-demo-policy-as-code/README.md)
* [10.09.2024 - Demo - Include vs. Import](2024-09-10-demo-include-vs-import/README.md)
* [12.12.2023 - Exercise - AAP Usage 102](2023-12-12-exercise-aap-usage-102/README.md)
* [08.08.2023 - Demo - Ansible and Terraform](2023-08-08-demo-ansible-and-terraform/README.md)
* [13.06.2023 - Demo - Hacking Playbooks](2023-06-13-demo-hacking-playbooks/README.md)
* [11.04.2023 - Exercise - Custom facts and plugins](2023-04-11-exercise-facts-and-filter-plugin/README.md)
* [13.12.2022 - Exercise - Best Practices](2022-12-13-exercise-best-practices/README.md)
* [08.11.2022 - Exercise - AAP Usage 101](2022-11-08-exercise-aap-usage-101/README.md)
* [13.09.2022 - Exercise - Jinja2 Templates](2022-09-13-exercise-templates/README.md)
